{
  "schema_version": "AGL_LITE_V1_2_1",
  "project_id": "AGL-LITE-EXAMPLE",
  "policy_version": "policy-v1.2.1",
  "created_at_utc": "2026-10-27T00:00:00Z",
  "run_id": "RUN-001",
  "agent_id": "AGENT_A",
  "runtime": "ChatGPT",
  "invocation_mode": "SCHEDULED",
  "started_at_utc": "2026-10-27T00:00:00Z",
  "status": "STARTED",
  "observed_repo": "OWNER/repository",
  "observed_ref": "refs/heads/exp-agl-lite",
  "observed_base_sha": "bbbbbbbbbbbbbbbbbbbbbbbbbbbbbbbbbbbbbbbb",
  "registry_sha": "bbbbbbbbbbbbbbbbbbbbbbbbbbbbbbbbbbbbbbbb",
  "observed_capabilities": [
    "git-read"
  ],
  "log_ref": "runs/RUN-001.json"
}
